{"data_version":"sha256-5f12ea23273d568f48108ddd351aae06dc068f688196806e801ba0104aaf7826","deployments":[{"availability":"listed","capabilities":{"audio_input":"unknown","audio_output":"unknown","embedding":"unknown","image_generation":"unknown","reasoning":"supported","streaming":"unknown","structured_output":"supported","tool_calling":"supported","video_generation":"unknown","video_input":"supported","vision":"supported"},"conflicts":[],"id":"pareto:z-ai%2Fglm-5.3-flash","lifecycle":"unknown","model_id":"zhipuai/glm-5.3-flash","observations":[{"capabilities":{"audio_input":"unknown","audio_output":"unknown","embedding":"unknown","image_generation":"unknown","reasoning":"supported","streaming":"unknown","structured_output":"supported","tool_calling":"supported","video_generation":"unknown","video_input":"supported","vision":"supported"},"context_window":1000000,"input_modalities":["text","image","video"],"lifecycle":"unknown","max_output_tokens":131072,"name":"GLM-5.3-Flash","output_modalities":["text"],"presence":"listed","pricing":{"currency":null,"note":"Source claim only; zero does not imply free access. Null currency/unit are unverified.","raw":{"cache_read":0.006,"input":0.03,"output":0.1},"unit":null},"source_id":"models-dev:ae8dc0e90fc636260bb0","source_record_id":"pareto/z-ai/glm-5.3-flash","verification":"registry_reported"}],"pricing_status":"reported","provider_id":"pareto","provider_model_id":"z-ai/glm-5.3-flash","verification":"registry_reported"}],"generated_at":"2026-10-19T04:56:12Z","kind":"provider","models":[{"developer_id":"zhipuai","id":"zhipuai/glm-5.3-flash","identity_status":"registry_reported","name":"GLM-5.3-Flash","source_ids":["models-dev-canonical:6dd88d7e8263eafc2f2c","models-dev:ae8dc0e90fc636260bb0","openclaw:3069c82f6ffb7b304e73"]}],"provider":{"endpoints":[{"base_url":"https://api.paretoinference.com/v1","protocol":null,"source_id":"models-dev:ae8dc0e90fc636260bb0","verification":"registry_reported"}],"id":"pareto","name":"Pareto Inference","plan":null,"region":null,"source_ids":["models-dev:ae8dc0e90fc636260bb0"]},"schema_version":"1.0.0","sources":[{"id":"models-dev-canonical:6dd88d7e8263eafc2f2c","license":"MIT","name":"models-dev-canonical","sha256":"6dd88d7e8263eafc2f2c83cedb99e2c4eaa86ae36c02ada635e29a443600ddb0","url":"https://models.dev/catalog.json?type=all","verification":"registry_reported"},{"id":"models-dev:07529b1486cac75acd6e","license":"MIT","name":"models-dev","sha256":"07529b1486cac75acd6eb1679d7ac070f7187e5a9423fec46646f4fa53127ca5","url":"https://models.dev/api.json?type=all","verification":"registry_reported"},{"id":"models-dev:1bde0a55283692db51be","license":"MIT","name":"models-dev","sha256":"1bde0a55283692db51bea2c1e122892f3fea3ebe01250fc0ba32902c7e4682b2","url":"https://models.dev/api.json?type=all","verification":"registry_reported"},{"id":"models-dev:265c2ff52279100af069","license":"MIT","name":"models-dev","sha256":"265c2ff52279100af069564441a1fa947b0cbc87de8a7a7fae6a229f199f80ed","url":"https://models.dev/api.json?type=all","verification":"registry_reported"},{"id":"models-dev:3f16fb9b253ef9929683","license":"MIT","name":"models-dev","sha256":"3f16fb9b253ef99296838f3d30c35c50d651f6e29c53fc33ff6216fec5182e2b","url":"https://models.dev/api.json?type=all","verification":"registry_reported"},{"id":"models-dev:4265c7a09116ddc0771e","license":"MIT","name":"models-dev","sha256":"4265c7a09116ddc0771e961fbadb26ba754fddce6fcb360ad138b63c54058273","url":"https://models.dev/api.json?type=all","verification":"registry_reported"},{"id":"models-dev:48905474229dc33fe438","license":"MIT","name":"models-dev","sha256":"48905474229dc33fe438007e4cb3a987f50ff1ec19eb28175ef9cb27fea2fd64","url":"https://models.dev/api.json?type=all","verification":"registry_reported"},{"id":"models-dev:539873712b4049198172","license":"MIT","name":"models-dev","sha256":"539873712b404919817231c05e89a1f584b8232867e15594b6f678b7ccae4d08","url":"https://models.dev/api.json?type=all","verification":"registry_reported"},{"id":"models-dev:75ee0ed943fd31642697","license":"MIT","name":"models-dev","sha256":"75ee0ed943fd3164269723152c1b464c11d285280df2c849732b933b827c4c77","url":"https://models.dev/api.json?type=all","verification":"registry_reported"},{"id":"models-dev:79be487fa062e5fd2a07","license":"MIT","name":"models-dev","sha256":"79be487fa062e5fd2a07901400494f9b87ef49a834cd10ea4c135dbff62a333b","url":"https://models.dev/api.json?type=all","verification":"registry_reported"},{"id":"models-dev:7ff4f26065342dee6f38","license":"MIT","name":"models-dev","sha256":"7ff4f26065342dee6f38561e0f6bad70a5aac8314b03ff70f5f06d93f0947d5c","url":"https://models.dev/api.json?type=all","verification":"registry_reported"},{"id":"models-dev:975e266700138bd5d852","license":"MIT","name":"models-dev","sha256":"975e266700138bd5d8520500836168d720d2ee7d6e708de952a687a810f8370f","url":"https://models.dev/api.json?type=all","verification":"registry_reported"},{"id":"models-dev:9c5318f9198b773703eb","license":"MIT","name":"models-dev","sha256":"9c5318f9198b773703eb420ca8d09d5d74e5fc27c85616375f4dd4642a48d526","url":"https://models.dev/api.json?type=all","verification":"registry_reported"},{"id":"models-dev:a044bbeaa83aa8ee18b6","license":"MIT","name":"models-dev","sha256":"a044bbeaa83aa8ee18b638461048cb63a635ad55ff0d9dab84fbb9bfec487601","url":"https://models.dev/api.json?type=all","verification":"registry_reported"},{"id":"models-dev:a1623ed80bced603e9f3","license":"MIT","name":"models-dev","sha256":"a1623ed80bced603e9f34911e3fa905dc82e740891a02d17f88c7eecf82f44d1","url":"https://models.dev/api.json?type=all","verification":"registry_reported"},{"id":"models-dev:ae8dc0e90fc636260bb0","license":"MIT","name":"models-dev","sha256":"ae8dc0e90fc636260bb00f448bcd4eeb5fdfc35b45cdaf46fe28bd7e6664eb3c","url":"https://models.dev/api.json?type=all","verification":"registry_reported"},{"id":"models-dev:bd42a7ffb18e9ec4295f","license":"MIT","name":"models-dev","sha256":"bd42a7ffb18e9ec4295f05e4274dc75a0cda8865adab8cfec11cd815dedcdf4e","url":"https://models.dev/api.json?type=all","verification":"registry_reported"},{"id":"models-dev:bfd363bea657bbc64864","license":"MIT","name":"models-dev","sha256":"bfd363bea657bbc648641b513f232cd6a37e3a0cb86bb4007574391bc97ce8dc","url":"https://models.dev/api.json?type=all","verification":"registry_reported"},{"id":"openclaw:3069c82f6ffb7b304e73","license":"MIT","name":"openclaw","sha256":"bf8276c6f995b284f49f707845f95e8ad2252b512bb3b2166d5d5ef8f5046391","url":"https://catalog.openclaw.ai/models/v2/catalog.json","verification":"registry_reported"},{"id":"openclaw:361d37d2aba25cae3e9c","license":"MIT","name":"openclaw","sha256":"403d669574c18ad381c5d8e1bddd850e7e6d3319f0de2d558e586d40e185ae51","url":"https://catalog.openclaw.ai/models/v2/catalog.json","verification":"registry_reported"},{"id":"openclaw:4773c0b70eb23c287965","license":"MIT","name":"openclaw","sha256":"90096da83090f5889b21b7eb16c3a93c597475adbe467b90ae343329c96b6601","url":"https://catalog.openclaw.ai/models/v2/catalog.json","verification":"registry_reported"},{"id":"openclaw:544695a1f733b0ebea9c","license":"MIT","name":"openclaw","sha256":"e51e8c43d8ac86980b3ae8c7a80e1dc4f3283bf5e040bdc383230f8ef4e78587","url":"https://catalog.openclaw.ai/models/v2/catalog.json","verification":"registry_reported"},{"id":"openclaw:73ba8a3a4706a2b83b52","license":"MIT","name":"openclaw","sha256":"8879b2ad38489d2602d79631f37d1fb2202d723bde3bf432eac46e795f5ad213","url":"https://catalog.openclaw.ai/models/v2/catalog.json","verification":"registry_reported"},{"id":"openclaw:a963dc731596242a0612","license":"MIT","name":"openclaw","sha256":"e5ae804c6b3f18d34111799406f4104c20aca1f1532507446cfba88ebe4c419b","url":"https://catalog.openclaw.ai/models/v2/catalog.json","verification":"registry_reported"},{"id":"openclaw:d2cda2e2004b30e39bec","license":"MIT","name":"openclaw","sha256":"a1d1ddd27a7c3518efd1375fe0ae68e15c93458cc1888d05007efc7d68963589","url":"https://catalog.openclaw.ai/models/v2/catalog.json","verification":"registry_reported"},{"id":"xiaomi-official-review:da36f977c19c5b2854b1","license":"selected factual observations; official documentation not relicensed","name":"xiaomi-official-review","sha256":"da36f977c19c5b2854b164982a857774257aeb1418593033770e9fb503739dbe","url":"https://github.com/smiler488/universal-ai-provider-registry/blob/main/data/reviewed-evidence.json","verification":"officially_documented"}]}
