{"data_version":"sha256-8ed6227090dc4f9eb0f62366745a6509c3a1614ca8d354090e1b03d1d45817eb","deployments":[{"availability":"listed","capabilities":{"audio_input":"unknown","audio_output":"unknown","embedding":"unknown","image_generation":"unknown","reasoning":"supported","streaming":"unknown","structured_output":"unknown","tool_calling":"supported","video_generation":"unknown","video_input":"unknown","vision":"supported"},"conflicts":[],"id":"agentrouter:claude-opus-4-8","lifecycle":"unknown","model_id":"anthropic/claude-opus-4-8","observations":[{"capabilities":{"audio_input":"unknown","audio_output":"unknown","embedding":"unknown","image_generation":"unknown","reasoning":"supported","streaming":"unknown","structured_output":"unknown","tool_calling":"supported","video_generation":"unknown","video_input":"unknown","vision":"supported"},"context_window":1000000,"input_modalities":["text","image","pdf"],"lifecycle":"unknown","max_output_tokens":128000,"name":"Claude Opus 4.8","output_modalities":["text"],"presence":"listed","pricing":null,"source_id":"models-dev:5998ba3a25a9901e560e","source_record_id":"agentrouter/claude-opus-4-8","verification":"registry_reported"}],"pricing_status":"unknown","provider_id":"agentrouter","provider_model_id":"claude-opus-4-8","verification":"registry_reported"},{"availability":"listed","capabilities":{"audio_input":"unknown","audio_output":"unknown","embedding":"unknown","image_generation":"unknown","reasoning":"supported","streaming":"unknown","structured_output":"unknown","tool_calling":"supported","video_generation":"unknown","video_input":"unknown","vision":"supported"},"conflicts":[],"id":"agentrouter:claude-opus-5","lifecycle":"unknown","model_id":"anthropic/claude-opus-5","observations":[{"capabilities":{"audio_input":"unknown","audio_output":"unknown","embedding":"unknown","image_generation":"unknown","reasoning":"supported","streaming":"unknown","structured_output":"unknown","tool_calling":"supported","video_generation":"unknown","video_input":"unknown","vision":"supported"},"context_window":1000000,"input_modalities":["text","image","pdf"],"lifecycle":"unknown","max_output_tokens":128000,"name":"Claude Opus 5","output_modalities":["text"],"presence":"listed","pricing":null,"source_id":"models-dev:5998ba3a25a9901e560e","source_record_id":"agentrouter/claude-opus-5","verification":"registry_reported"}],"pricing_status":"unknown","provider_id":"agentrouter","provider_model_id":"claude-opus-5","verification":"registry_reported"},{"availability":"listed","capabilities":{"audio_input":"unknown","audio_output":"unknown","embedding":"unknown","image_generation":"unknown","reasoning":"supported","streaming":"unknown","structured_output":"supported","tool_calling":"supported","video_generation":"unknown","video_input":"unknown","vision":"unknown"},"conflicts":[],"id":"agentrouter:deepseek-v4-flash","lifecycle":"unknown","model_id":"deepseek/deepseek-v4-flash","observations":[{"capabilities":{"audio_input":"unknown","audio_output":"unknown","embedding":"unknown","image_generation":"unknown","reasoning":"supported","streaming":"unknown","structured_output":"supported","tool_calling":"supported","video_generation":"unknown","video_input":"unknown","vision":"unknown"},"context_window":1000000,"input_modalities":["text"],"lifecycle":"unknown","max_output_tokens":384000,"name":"DeepSeek V4 Flash","output_modalities":["text"],"presence":"listed","pricing":null,"source_id":"models-dev:5998ba3a25a9901e560e","source_record_id":"agentrouter/deepseek-v4-flash","verification":"registry_reported"}],"pricing_status":"unknown","provider_id":"agentrouter","provider_model_id":"deepseek-v4-flash","verification":"registry_reported"},{"availability":"listed","capabilities":{"audio_input":"unknown","audio_output":"unknown","embedding":"unknown","image_generation":"unknown","reasoning":"supported","streaming":"unknown","structured_output":"supported","tool_calling":"supported","video_generation":"unknown","video_input":"unknown","vision":"unknown"},"conflicts":[],"id":"agentrouter:glm-5.3","lifecycle":"unknown","model_id":"zhipuai/glm-5.3","observations":[{"capabilities":{"audio_input":"unknown","audio_output":"unknown","embedding":"unknown","image_generation":"unknown","reasoning":"supported","streaming":"unknown","structured_output":"supported","tool_calling":"supported","video_generation":"unknown","video_input":"unknown","vision":"unknown"},"context_window":1000000,"input_modalities":["text"],"lifecycle":"unknown","max_output_tokens":131072,"name":"GLM-5.3","output_modalities":["text"],"presence":"listed","pricing":null,"source_id":"models-dev:5998ba3a25a9901e560e","source_record_id":"agentrouter/glm-5.3","verification":"registry_reported"}],"pricing_status":"unknown","provider_id":"agentrouter","provider_model_id":"glm-5.3","verification":"registry_reported"},{"availability":"listed","capabilities":{"audio_input":"unknown","audio_output":"unknown","embedding":"unknown","image_generation":"unknown","reasoning":"supported","streaming":"unknown","structured_output":"supported","tool_calling":"supported","video_generation":"unknown","video_input":"unknown","vision":"supported"},"conflicts":[],"id":"agentrouter:gpt-5.6-sol","lifecycle":"unknown","model_id":"openai/gpt-5.6-sol","observations":[{"capabilities":{"audio_input":"unknown","audio_output":"unknown","embedding":"unknown","image_generation":"unknown","reasoning":"supported","streaming":"unknown","structured_output":"supported","tool_calling":"supported","video_generation":"unknown","video_input":"unknown","vision":"supported"},"context_window":1050000,"input_modalities":["text","image","pdf"],"lifecycle":"unknown","max_output_tokens":128000,"name":"GPT-5.6 Sol","output_modalities":["text"],"presence":"listed","pricing":null,"source_id":"models-dev:5998ba3a25a9901e560e","source_record_id":"agentrouter/gpt-5.6-sol","verification":"registry_reported"}],"pricing_status":"unknown","provider_id":"agentrouter","provider_model_id":"gpt-5.6-sol","verification":"registry_reported"}],"generated_at":"2026-10-14T03:33:41Z","kind":"provider","models":[{"developer_id":"anthropic","id":"anthropic/claude-opus-4-8","identity_status":"registry_reported","name":"Claude Opus 4.8","source_ids":["models-dev-canonical:96fb32b0210b83127bde","models-dev:5998ba3a25a9901e560e","openclaw:c9be2e97e585473304fa"]},{"developer_id":"anthropic","id":"anthropic/claude-opus-5","identity_status":"registry_reported","name":"Claude Opus 5","source_ids":["models-dev-canonical:96fb32b0210b83127bde","models-dev:5998ba3a25a9901e560e","openclaw:c9be2e97e585473304fa"]},{"developer_id":"deepseek","id":"deepseek/deepseek-v4-flash","identity_status":"registry_reported","name":"DeepSeek V4 Flash","source_ids":["models-dev-canonical:96fb32b0210b83127bde","models-dev:5998ba3a25a9901e560e","openclaw:c9be2e97e585473304fa"]},{"developer_id":"openai","id":"openai/gpt-5.6-sol","identity_status":"registry_reported","name":"GPT-5.6 Sol","source_ids":["models-dev-canonical:96fb32b0210b83127bde","models-dev:5998ba3a25a9901e560e","openclaw:c9be2e97e585473304fa"]},{"developer_id":"zhipuai","id":"zhipuai/glm-5.3","identity_status":"registry_reported","name":"GLM-5.3","source_ids":["models-dev-canonical:96fb32b0210b83127bde","models-dev:5998ba3a25a9901e560e","openclaw:c9be2e97e585473304fa"]}],"provider":{"endpoints":[{"base_url":"https://agentrouter.org/v1","protocol":null,"source_id":"models-dev:5998ba3a25a9901e560e","verification":"registry_reported"}],"id":"agentrouter","name":"AgentRouter","plan":null,"region":null,"source_ids":["models-dev:5998ba3a25a9901e560e"]},"schema_version":"1.0.0","sources":[{"id":"models-dev-canonical:96fb32b0210b83127bde","license":"MIT","name":"models-dev-canonical","sha256":"96fb32b0210b83127bde4f66102260f4c11930ed8c42951dd55025ad75100a64","url":"https://models.dev/catalog.json?type=all","verification":"registry_reported"},{"id":"models-dev:5998ba3a25a9901e560e","license":"MIT","name":"models-dev","sha256":"5998ba3a25a9901e560e30e456483fda5de43b63f7812f42989b5663b5ae281d","url":"https://models.dev/api.json?type=all","verification":"registry_reported"},{"id":"openclaw:c9be2e97e585473304fa","license":"MIT","name":"openclaw","sha256":"fe7f96fff589e88538550494919da0834311e05810286d63a8dc2c7bc62eaec5","url":"https://catalog.openclaw.ai/models/v2/catalog.json","verification":"registry_reported"},{"id":"xiaomi-official-review:da36f977c19c5b2854b1","license":"selected factual observations; official documentation not relicensed","name":"xiaomi-official-review","sha256":"da36f977c19c5b2854b164982a857774257aeb1418593033770e9fb503739dbe","url":"https://github.com/smiler488/universal-ai-provider-registry/blob/main/data/reviewed-evidence.json","verification":"officially_documented"}]}
