{"data_version":"sha256-2c79e1e3d043ff2488b652fb6677331c52fb4e211b68b39a5c1f4c759f5c5195","deployments":[{"availability":"listed","capabilities":{"audio_input":"unknown","audio_output":"unknown","embedding":"unknown","image_generation":"unknown","reasoning":"supported","streaming":"unknown","structured_output":"supported","tool_calling":"supported","video_generation":"unknown","video_input":"supported","vision":"supported"},"conflicts":[],"id":"moonshotai-cn:kimi-k2.6","lifecycle":"unknown","model_id":"unresolved/moonshotai-cn/kimi-k2.6","observations":[{"capabilities":{"audio_input":"unknown","audio_output":"unknown","embedding":"unknown","image_generation":"unknown","reasoning":"supported","streaming":"unknown","structured_output":"supported","tool_calling":"supported","video_generation":"unknown","video_input":"supported","vision":"supported"},"context_window":262144,"input_modalities":["text","image","video"],"lifecycle":"unknown","max_output_tokens":262144,"name":"Kimi K2.6","output_modalities":["text"],"presence":"listed","pricing":{"currency":null,"note":"Source claim only; zero does not imply free access. Null currency/unit are unverified.","raw":{"cache_read":0.16,"input":0.95,"output":4},"unit":null},"source_id":"models-dev:5998ba3a25a9901e560e","source_record_id":"moonshotai-cn/kimi-k2.6","verification":"registry_reported"}],"pricing_status":"reported","provider_id":"moonshotai-cn","provider_model_id":"kimi-k2.6","verification":"registry_reported"},{"availability":"listed","capabilities":{"audio_input":"unknown","audio_output":"unknown","embedding":"unknown","image_generation":"unknown","reasoning":"supported","streaming":"unknown","structured_output":"supported","tool_calling":"supported","video_generation":"unknown","video_input":"supported","vision":"supported"},"conflicts":[],"id":"moonshotai-cn:kimi-k2.7-code","lifecycle":"unknown","model_id":"moonshotai/kimi-k2.7-code","observations":[{"capabilities":{"audio_input":"unknown","audio_output":"unknown","embedding":"unknown","image_generation":"unknown","reasoning":"supported","streaming":"unknown","structured_output":"supported","tool_calling":"supported","video_generation":"unknown","video_input":"supported","vision":"supported"},"context_window":262144,"input_modalities":["text","image","video"],"lifecycle":"unknown","max_output_tokens":262144,"name":"Kimi K2.7 Code","output_modalities":["text"],"presence":"listed","pricing":{"currency":null,"note":"Source claim only; zero does not imply free access. Null currency/unit are unverified.","raw":{"cache_read":0.19,"input":0.95,"output":4},"unit":null},"source_id":"models-dev:5998ba3a25a9901e560e","source_record_id":"moonshotai-cn/kimi-k2.7-code","verification":"registry_reported"}],"pricing_status":"reported","provider_id":"moonshotai-cn","provider_model_id":"kimi-k2.7-code","verification":"registry_reported"},{"availability":"listed","capabilities":{"audio_input":"unknown","audio_output":"unknown","embedding":"unknown","image_generation":"unknown","reasoning":"supported","streaming":"unknown","structured_output":"supported","tool_calling":"supported","video_generation":"unknown","video_input":"supported","vision":"supported"},"conflicts":[],"id":"moonshotai-cn:kimi-k2.7-code-highspeed","lifecycle":"unknown","model_id":"moonshotai/kimi-k2.7-code","observations":[{"capabilities":{"audio_input":"unknown","audio_output":"unknown","embedding":"unknown","image_generation":"unknown","reasoning":"supported","streaming":"unknown","structured_output":"supported","tool_calling":"supported","video_generation":"unknown","video_input":"supported","vision":"supported"},"context_window":262144,"input_modalities":["text","image","video"],"lifecycle":"unknown","max_output_tokens":262144,"name":"Kimi K2.7 Code HighSpeed","output_modalities":["text"],"presence":"listed","pricing":{"currency":null,"note":"Source claim only; zero does not imply free access. Null currency/unit are unverified.","raw":{"cache_read":0.38,"input":1.9,"output":8},"unit":null},"source_id":"models-dev:5998ba3a25a9901e560e","source_record_id":"moonshotai-cn/kimi-k2.7-code-highspeed","verification":"registry_reported"}],"pricing_status":"reported","provider_id":"moonshotai-cn","provider_model_id":"kimi-k2.7-code-highspeed","verification":"registry_reported"},{"availability":"listed","capabilities":{"audio_input":"unknown","audio_output":"unknown","embedding":"unknown","image_generation":"unknown","reasoning":"supported","streaming":"unknown","structured_output":"supported","tool_calling":"supported","video_generation":"unknown","video_input":"supported","vision":"supported"},"conflicts":[],"id":"moonshotai-cn:kimi-k3","lifecycle":"unknown","model_id":"moonshotai/kimi-k3","observations":[{"capabilities":{"audio_input":"unknown","audio_output":"unknown","embedding":"unknown","image_generation":"unknown","reasoning":"supported","streaming":"unknown","structured_output":"supported","tool_calling":"supported","video_generation":"unknown","video_input":"supported","vision":"supported"},"context_window":1048576,"input_modalities":["text","image","video"],"lifecycle":"unknown","max_output_tokens":1048576,"name":"Kimi K3","output_modalities":["text"],"presence":"listed","pricing":{"currency":null,"note":"Source claim only; zero does not imply free access. Null currency/unit are unverified.","raw":{"cache_read":0.3,"cache_write":3,"input":3,"output":15},"unit":null},"source_id":"models-dev:5998ba3a25a9901e560e","source_record_id":"moonshotai-cn/kimi-k3","verification":"registry_reported"}],"pricing_status":"reported","provider_id":"moonshotai-cn","provider_model_id":"kimi-k3","verification":"registry_reported"}],"generated_at":"2026-10-14T03:19:47Z","kind":"provider","models":[{"developer_id":"moonshotai","id":"moonshotai/kimi-k2.7-code","identity_status":"registry_reported","name":"Kimi K2.7 Code","source_ids":["models-dev-canonical:96fb32b0210b83127bde","models-dev:5998ba3a25a9901e560e","openclaw:c9be2e97e585473304fa"]},{"developer_id":"moonshotai","id":"moonshotai/kimi-k3","identity_status":"registry_reported","name":"Kimi K3","source_ids":["models-dev-canonical:96fb32b0210b83127bde","models-dev:5998ba3a25a9901e560e","openclaw:c9be2e97e585473304fa"]},{"developer_id":null,"id":"unresolved/moonshotai-cn/kimi-k2.6","identity_status":"unknown","name":"Kimi K2.6","source_ids":["models-dev:5998ba3a25a9901e560e"]}],"provider":{"endpoints":[{"base_url":"https://api.moonshot.cn/v1","protocol":null,"source_id":"models-dev:5998ba3a25a9901e560e","verification":"registry_reported"}],"id":"moonshotai-cn","name":"Moonshot AI (China)","plan":null,"region":null,"source_ids":["models-dev:5998ba3a25a9901e560e"]},"schema_version":"1.0.0","sources":[{"id":"models-dev-canonical:96fb32b0210b83127bde","license":"MIT","name":"models-dev-canonical","sha256":"96fb32b0210b83127bde4f66102260f4c11930ed8c42951dd55025ad75100a64","url":"https://models.dev/catalog.json?type=all","verification":"registry_reported"},{"id":"models-dev:5998ba3a25a9901e560e","license":"MIT","name":"models-dev","sha256":"5998ba3a25a9901e560e30e456483fda5de43b63f7812f42989b5663b5ae281d","url":"https://models.dev/api.json?type=all","verification":"registry_reported"},{"id":"openclaw:c9be2e97e585473304fa","license":"MIT","name":"openclaw","sha256":"fe7f96fff589e88538550494919da0834311e05810286d63a8dc2c7bc62eaec5","url":"https://catalog.openclaw.ai/models/v2/catalog.json","verification":"registry_reported"},{"id":"xiaomi-official-review:e6c700c71715a103c687","license":"selected factual observations; official documentation not relicensed","name":"xiaomi-official-review","sha256":"e6c700c71715a103c6877e32b737da53d068a1dfaf48cb6b64fcf6cac162877c","url":"https://github.com/smiler488/universal-ai-provider-registry/blob/main/data/mimo-official.json","verification":"officially_documented"}]}
