{"data_version":"sha256-38b0f2f2763c50a6bffdcbf7cf134b06b9c97d34f41ac031d20d615e54f35693","deployments":[{"availability":"listed","capabilities":{"audio_input":"unknown","audio_output":"unknown","embedding":"unknown","image_generation":"unknown","reasoning":"supported","streaming":"unknown","structured_output":"supported","tool_calling":"supported","video_generation":"unknown","video_input":"unknown","vision":"supported"},"conflicts":[],"id":"kosmik:qwen%2Fqwen3.8-27b","lifecycle":"unknown","model_id":"alibaba/qwen3.8-27b","observations":[{"capabilities":{"audio_input":"unknown","audio_output":"unknown","embedding":"unknown","image_generation":"unknown","reasoning":"supported","streaming":"unknown","structured_output":"supported","tool_calling":"supported","video_generation":"unknown","video_input":"unknown","vision":"supported"},"context_window":262144,"input_modalities":["text","image"],"lifecycle":"unknown","max_output_tokens":32768,"name":"Qwen3.8 27B","output_modalities":["text"],"presence":"listed","pricing":{"currency":null,"note":"Source claim only; zero does not imply free access. Null currency/unit are unverified.","raw":{"cache_read":0.09,"input":0.35,"output":2.2},"unit":null},"source_id":"models-dev:397968c55ca5a80e23a7","source_record_id":"kosmik/qwen/qwen3.8-27b","verification":"registry_reported"}],"pricing_status":"reported","provider_id":"kosmik","provider_model_id":"qwen/qwen3.8-27b","verification":"registry_reported"}],"generated_at":"2026-10-16T11:38:53Z","kind":"provider","models":[{"developer_id":"alibaba","id":"alibaba/qwen3.8-27b","identity_status":"registry_reported","name":"Qwen3.8 27B","source_ids":["models-dev-canonical:bd08055d64a8f571d27c","models-dev:397968c55ca5a80e23a7","openclaw:3c377374afc13c879a99"]}],"provider":{"endpoints":[{"base_url":"https://api.koscompute.com/v1","protocol":null,"source_id":"models-dev:397968c55ca5a80e23a7","verification":"registry_reported"}],"id":"kosmik","name":"Kosmik Compute","plan":null,"region":null,"source_ids":["models-dev:397968c55ca5a80e23a7"]},"schema_version":"1.0.0","sources":[{"id":"models-dev-canonical:bd08055d64a8f571d27c","license":"MIT","name":"models-dev-canonical","sha256":"bd08055d64a8f571d27cf1261c2800bc4aed679daecbe01c7e725cbb47b48611","url":"https://models.dev/catalog.json?type=all","verification":"registry_reported"},{"id":"models-dev:07529b1486cac75acd6e","license":"MIT","name":"models-dev","sha256":"07529b1486cac75acd6eb1679d7ac070f7187e5a9423fec46646f4fa53127ca5","url":"https://models.dev/api.json?type=all","verification":"registry_reported"},{"id":"models-dev:1bde0a55283692db51be","license":"MIT","name":"models-dev","sha256":"1bde0a55283692db51bea2c1e122892f3fea3ebe01250fc0ba32902c7e4682b2","url":"https://models.dev/api.json?type=all","verification":"registry_reported"},{"id":"models-dev:265c2ff52279100af069","license":"MIT","name":"models-dev","sha256":"265c2ff52279100af069564441a1fa947b0cbc87de8a7a7fae6a229f199f80ed","url":"https://models.dev/api.json?type=all","verification":"registry_reported"},{"id":"models-dev:397968c55ca5a80e23a7","license":"MIT","name":"models-dev","sha256":"397968c55ca5a80e23a7af9867e754600a632277e4a1be979aea8c1879bbe8c1","url":"https://models.dev/api.json?type=all","verification":"registry_reported"},{"id":"models-dev:3f16fb9b253ef9929683","license":"MIT","name":"models-dev","sha256":"3f16fb9b253ef99296838f3d30c35c50d651f6e29c53fc33ff6216fec5182e2b","url":"https://models.dev/api.json?type=all","verification":"registry_reported"},{"id":"models-dev:7ff4f26065342dee6f38","license":"MIT","name":"models-dev","sha256":"7ff4f26065342dee6f38561e0f6bad70a5aac8314b03ff70f5f06d93f0947d5c","url":"https://models.dev/api.json?type=all","verification":"registry_reported"},{"id":"models-dev:975e266700138bd5d852","license":"MIT","name":"models-dev","sha256":"975e266700138bd5d8520500836168d720d2ee7d6e708de952a687a810f8370f","url":"https://models.dev/api.json?type=all","verification":"registry_reported"},{"id":"models-dev:9c5318f9198b773703eb","license":"MIT","name":"models-dev","sha256":"9c5318f9198b773703eb420ca8d09d5d74e5fc27c85616375f4dd4642a48d526","url":"https://models.dev/api.json?type=all","verification":"registry_reported"},{"id":"models-dev:a1623ed80bced603e9f3","license":"MIT","name":"models-dev","sha256":"a1623ed80bced603e9f34911e3fa905dc82e740891a02d17f88c7eecf82f44d1","url":"https://models.dev/api.json?type=all","verification":"registry_reported"},{"id":"openclaw:3c377374afc13c879a99","license":"MIT","name":"openclaw","sha256":"0eef6040255c63cf0b405c06f47aab515acc71659a1e2b9ce137efc4b7aa8266","url":"https://catalog.openclaw.ai/models/v2/catalog.json","verification":"registry_reported"},{"id":"openclaw:4773c0b70eb23c287965","license":"MIT","name":"openclaw","sha256":"90096da83090f5889b21b7eb16c3a93c597475adbe467b90ae343329c96b6601","url":"https://catalog.openclaw.ai/models/v2/catalog.json","verification":"registry_reported"},{"id":"openclaw:73ba8a3a4706a2b83b52","license":"MIT","name":"openclaw","sha256":"8879b2ad38489d2602d79631f37d1fb2202d723bde3bf432eac46e795f5ad213","url":"https://catalog.openclaw.ai/models/v2/catalog.json","verification":"registry_reported"},{"id":"openclaw:a963dc731596242a0612","license":"MIT","name":"openclaw","sha256":"e5ae804c6b3f18d34111799406f4104c20aca1f1532507446cfba88ebe4c419b","url":"https://catalog.openclaw.ai/models/v2/catalog.json","verification":"registry_reported"},{"id":"openclaw:d2cda2e2004b30e39bec","license":"MIT","name":"openclaw","sha256":"a1d1ddd27a7c3518efd1375fe0ae68e15c93458cc1888d05007efc7d68963589","url":"https://catalog.openclaw.ai/models/v2/catalog.json","verification":"registry_reported"},{"id":"xiaomi-official-review:da36f977c19c5b2854b1","license":"selected factual observations; official documentation not relicensed","name":"xiaomi-official-review","sha256":"da36f977c19c5b2854b164982a857774257aeb1418593033770e9fb503739dbe","url":"https://github.com/smiler488/universal-ai-provider-registry/blob/main/data/reviewed-evidence.json","verification":"officially_documented"}]}
